"Reflected server-side cross-site scripting","Writing user input directly to a web page allows for a cross-site scripting vulnerability.","error","Cross-site scripting vulnerability due to a [[""user-provided value""|""relative:///cms/cms_plugins.py:76:28:76:34""]].","/cms/cms_plugins.py","88","47","88","81"
"Reflected server-side cross-site scripting","Writing user input directly to a web page allows for a cross-site scripting vulnerability.","error","Cross-site scripting vulnerability due to a [[""user-provided value""|""relative:///cms/cms_plugins.py:76:28:76:34""]].","/cms/cms_plugins.py","94","47","94","86"
"Information exposure through an exception","Leaking information about an exception, such as messages and stack traces, to an external user can expose implementation details that are useful to an attacker for developing a subsequent exploit.","error","[[""Stack trace information""|""relative:///cms/admin/placeholderadmin.py:239:38:239:39""]] flows to this location and may be exposed to an external user.
[[""Stack trace information""|""relative:///cms/admin/placeholderadmin.py:239:38:239:39""]] flows to this location and may be exposed to an external user.","/cms/admin/placeholderadmin.py","240","43","240","44"
"Information exposure through an exception","Leaking information about an exception, such as messages and stack traces, to an external user can expose implementation details that are useful to an attacker for developing a subsequent exploit.","error","[[""Stack trace information""|""relative:///cms/admin/placeholderadmin.py:464:42:464:43""]] flows to this location and may be exposed to an external user.
[[""Stack trace information""|""relative:///cms/admin/placeholderadmin.py:464:42:464:43""]] flows to this location and may be exposed to an external user.","/cms/admin/placeholderadmin.py","465","47","465","48"
"Inefficient regular expression","A regular expression that requires exponential time to match certain inputs can be a performance bottleneck, and may be vulnerable to denial-of-service attacks.","error","This part of the regular expression may cause exponential backtracking on strings starting with '-copy-' and containing many repetitions of '0'.","/cms/utils/page.py","8","45","8","47"
